{
  "versionCode": 50,
  "versionName": "0.1.49",
  "minSupportedVersionCode": 1,
  "apkUrl": "https://raw.githubusercontent.com/lpiriz-oss/SurTV-relases/main/releases/apk/surtv-0.1.49.apk",
  "sha256": "7f89a29edeb2412ca432be5422932f3165655367e2cf6334489752538db786bb",
  "sizeBytes": 33909735,
  "releasedAt": "2026-09-29T22:48:50Z",
  "mandatory": false,
  "notes": [
    "Mejora el inicio y el zapping de canales Portal."
  ]
}
